{
  "_comment": "Copy this file to <airline>.config.json and fill in every value. Do NOT commit secrets — store API tokens in Neo key-value store or environment variables.",

  "airline": {
    "AIRLINE_NAME": "YourAirline",
    "LOYALTY_CURRENCY_NAME": "YourMiles",
    "AIRLINE_IDENTIFIER_TYPE": "externalid"
  },

  "endpoints": {
    "DAG_URL_PRFLOWN": "preFlownBookings",
    "DAG_URL_POSTFLOWN": "postFlownBookings",
    "DAG_URL_CANCEL": "cancelBookings",
    "DAG_URL_UPDATE_COUPON": "update-coupon-redemption",
    "DAG_URL_UPDATE_POINTS": "updatePointsRedemption",
    "DAG_URL_FRAUD": "v1/block-fraud-customers",

    "VALIDATE_ALIAS_URL": "http://neo-a.default:3000/api/v1/<org>/execute/ValidateFFN",
    "TRANSACTION_BULK_ADD_URL": "https://<region>.api.capillarytech.com/v2/transactions/bulk",
    "TRANSACTION_RETURN_URL": "https://<region>.api.capillarytech.com/v2/transactions/return",
    "COUPON_REDEEM_URL": "https://<region>.api.capillarytech.com/v2/coupon/redeem",
    "UPDATE_REDEMPTION_URL": "https://<region>.api.capillarytech.com/v2/points/redeem",
    "CUSTOMER_LOOKUP_URL": "https://<region>.api.capillarytech.com/v2/customers/{customerId}",
    "UPDATE_CUSTOMER_STATUS_URL": "https://<region>.api.capillarytech.com/v2/customers/lookup/status",
    "EMAIL_API_URL": "https://<region>.api.capillarytech.com/v1.1/communications/email"
  },

  "mongodb": {
    "MONGO_PNR_TRANSACTIONS_COLLECTION": "PNR_Transactions",
    "MONGO_UTILISED_PNR_COLLECTION": "UtilisedPNR",
    "MONGO_BOOKING_COLLECTION": "Bookings",
    "MONGO_ALIAS_REJECTION_COLLECTION": "postflown_alias_rejection",
    "MONGO_COUPON_REDEMPTION_COLLECTION": "CouponRedemptions",
    "MONGO_POINTS_REDEMPTION_COLLECTION": "PointsRedemptions",
    "MONGO_EMAIL_BLACKLIST_COLLECTION": "emailDomainBlacklist"
  },

  "keyValueStore": {
    "FRAUD_CUSTOMER_EMAIL_CONFIG_KEY": "FRAUD_CUSTOMER_EMAIL_CONFIG",
    "FRAUD_TRANSACTION_EMAIL_CONFIG_KEY": "FRAUD_TRANSACTION_ADDED_EMAIL_CONFIG",
    "PNR_NOTIFICATION_THRESHOLD_KEY": "PNR_NOTIFICATION_THRESHOLD",
    "FRAUD_CUSTOMER_STATUS_UPDATE_KEY": "FRAUD_CUSTOMER_STATUS_UPDATE"
  },

  "businessRules": {
    "MAX_PAYLOAD_SIZE": 20,
    "MAX_BILLING_DAYS_LOOKBACK": 90,
    "STAFF_CLASS_CODES": ["x", "g", "g2"],
    "STAFF_PAX_TYPES": ["stf"],
    "CODESHARE_SOURCES": ["oc"],
    "STAFF_SOURCE_ORG_CODES": []
  },

  "versioning": {
    "APP_VERSION": "1.0.0"
  }
}
